{
  "$schema": "https://json-schema.org/draft/2020-12/schema",
  "type": "array",
  "items": {
    "type": "object",
    "required": ["iso3", "iso_num", "name", "region", "tfr", "tfr_year", "factors"],
    "properties": {
      "iso3": {"type": "string", "minLength": 2, "maxLength": 3},
      "iso_num": {"type": "integer"},
      "name": {"type": "string"},
      "region": {"type": "string"},
      "tfr": {"type": ["number", "null"]},
      "tfr_year": {"type": ["integer", "null"]},
      "factors": {
        "type": "object",
        "additionalProperties": {"type": ["number", "null"]}
      }
    }
  }
}
