[
  {
    "iso3": "ABW",
    "iso_num": 533,
    "name": "Aruba",
    "region": "Latin America & Caribbean",
    "tfr": 1.606,
    "tfr_year": 2024,
    "factors": {
      "gdp_pc": 44558.9287594176,
      "gini": null,
      "fem_sec_enroll": 128.74852420307,
      "fem_years_schooling": null,
      "flfp": null,
      "gii": null,
      "contraceptive": null,
      "child_mortality": null,
      "adolescent_fertility": 18.021,
      "urbanisation": 61.7909396819594,
      "social_cohesion": null
    }
  },
  {
    "iso3": "AFG",
    "iso_num": 4,
    "name": "Afghanistan",
    "region": "Middle East, North Africa, Afghanistan & Pakistan",
    "tfr": 4.761,
    "tfr_year": 2024,
    "factors": {
      "gdp_pc": 1983.81261992909,
      "gini": null,
      "fem_sec_enroll": 45.1596908569336,
      "fem_years_schooling": null,
      "flfp": 5.123,
      "gii": null,
      "contraceptive": 22.5,
      "child_mortality": 53.0,
      "adolescent_fertility": 61.501,
      "urbanisation": 25.7007352636188,
      "social_cohesion": null
    }
  },
  {
    "iso3": "AGO",
    "iso_num": 24,
    "name": "Angola",
    "region": "Sub-Saharan Africa",
    "tfr": 5.048,
    "tfr_year": 2024,
    "factors": {
      "gdp_pc": 8901.88736611562,
      "gini": 51.3,
      "fem_sec_enroll": 48.1175394651696,
      "fem_years_schooling": null,
      "flfp": 72.359,
      "gii": null,
      "contraceptive": 13.7,
      "child_mortality": 49.0,
      "adolescent_fertility": 139.388,
      "urbanisation": 70.6551379036435,
      "social_cohesion": null
    }
  },
  {
    "iso3": "ALB",
    "iso_num": 8,
    "name": "Albania",
    "region": "Europe & Central Asia",
    "tfr": 1.341,
    "tfr_year": 2024,
    "factors": {
      "gdp_pc": 21641.0733223921,
      "gini": 29.4,
      "fem_sec_enroll": 106.71573638916,
      "fem_years_schooling": null,
      "flfp": 58.154,
      "gii": null,
      "contraceptive": 46.0,
      "child_mortality": 9.2,
      "adolescent_fertility": 12.399,
      "urbanisation": 58.5463634043555,
      "social_cohesion": null
    }
  },
  {
    "iso3": "AND",
    "iso_num": 20,
    "name": "Andorra",
    "region": "Europe & Central Asia",
    "tfr": 1.087,
    "tfr_year": 2024,
    "factors": {
      "gdp_pc": 65928.3071971004,
      "gini": null,
      "fem_sec_enroll": 101.475868225098,
      "fem_years_schooling": null,
      "flfp": null,
      "gii": null,
      "contraceptive": null,
      "child_mortality": 2.5,
      "adolescent_fertility": 3.4,
      "urbanisation": 88.8850044816278,
      "social_cohesion": null
    }
  },
  {
    "iso3": "ARE",
    "iso_num": 784,
    "name": "United Arab Emirates",
    "region": "Middle East, North Africa, Afghanistan & Pakistan",
    "tfr": 1.213,
    "tfr_year": 2024,
    "factors": {
      "gdp_pc": 69701.8047983545,
      "gini": 26.4,
      "fem_sec_enroll": 100.110276412248,
      "fem_years_schooling": null,
      "flfp": 52.519,
      "gii": null,
      "contraceptive": null,
      "child_mortality": 4.8,
      "adolescent_fertility": 2.817,
      "urbanisation": 85.8171088279791,
      "social_cohesion": null
    }
  },
  {
    "iso3": "ARG",
    "iso_num": 32,
    "name": "Argentina",
    "region": "Latin America & Caribbean",
    "tfr": 1.504,
    "tfr_year": 2024,
    "factors": {
      "gdp_pc": 26771.9657650571,
      "gini": 42.4,
      "fem_sec_enroll": 107.980730920017,
      "fem_years_schooling": null,
      "flfp": 52.281,
      "gii": null,
      "contraceptive": 70.1027087175867,
      "child_mortality": 9.5,
      "adolescent_fertility": 25.56,
      "urbanisation": 92.2742315972952,
      "social_cohesion": null
    }
  },
  {
    "iso3": "ARM",
    "iso_num": 51,
    "name": "Armenia",
    "region": "Europe & Central Asia",
    "tfr": 1.7,
    "tfr_year": 2024,
    "factors": {
      "gdp_pc": 20078.7848984844,
      "gini": 27.4,
      "fem_sec_enroll": 90.1346954711088,
      "fem_years_schooling": null,
      "flfp": 51.586,
      "gii": null,
      "contraceptive": 57.1,
      "child_mortality": 9.6,
      "adolescent_fertility": 12.823,
      "urbanisation": 65.8113671449901,
      "social_cohesion": null
    }
  },
  {
    "iso3": "ASM",
    "iso_num": 16,
    "name": "American Samoa",
    "region": "East Asia & Pacific",
    "tfr": 2.267,
    "tfr_year": 2024,
    "factors": {
      "gdp_pc": null,
      "gini": null,
      "fem_sec_enroll": null,
      "fem_years_schooling": null,
      "flfp": null,
      "gii": null,
      "contraceptive": null,
      "child_mortality": null,
      "adolescent_fertility": 34.749,
      "urbanisation": 80.9446986961818,
      "social_cohesion": null
    }
  },
  {
    "iso3": "ATG",
    "iso_num": 28,
    "name": "Antigua and Barbuda",
    "region": "Latin America & Caribbean",
    "tfr": 1.582,
    "tfr_year": 2024,
    "factors": {
      "gdp_pc": 29371.637778586,
      "gini": null,
      "fem_sec_enroll": 109.004008633981,
      "fem_years_schooling": null,
      "flfp": null,
      "gii": null,
      "contraceptive": null,
      "child_mortality": 9.1,
      "adolescent_fertility": 32.078,
      "urbanisation": 24.3906919254799,
      "social_cohesion": null
    }
  },
  {
    "iso3": "AUS",
    "iso_num": 36,
    "name": "Australia",
    "region": "East Asia & Pacific",
    "tfr": 1.481,
    "tfr_year": 2024,
    "factors": {
      "gdp_pc": 60303.9817116245,
      "gini": 33.8,
      "fem_sec_enroll": 129.089096069336,
      "fem_years_schooling": null,
      "flfp": 62.647,
      "gii": null,
      "contraceptive": 66.93,
      "child_mortality": 3.6,
      "adolescent_fertility": 6.419,
      "urbanisation": 87.6021469990446,
      "social_cohesion": null
    }
  },
  {
    "iso3": "AUT",
    "iso_num": 40,
    "name": "Austria",
    "region": "Europe & Central Asia",
    "tfr": 1.31,
    "tfr_year": 2024,
    "factors": {
      "gdp_pc": 63788.078678479,
      "gini": 31.2,
      "fem_sec_enroll": 99.9565505981445,
      "fem_years_schooling": null,
      "flfp": 55.408,
      "gii": null,
      "contraceptive": null,
      "child_mortality": 3.3,
      "adolescent_fertility": 3.605,
      "urbanisation": 69.4658181096788,
      "social_cohesion": null
    }
  },
  {
    "iso3": "AZE",
    "iso_num": 31,
    "name": "Azerbaijan",
    "region": "Europe & Central Asia",
    "tfr": 1.43,
    "tfr_year": 2024,
    "factors": {
      "gdp_pc": 22072.1491157176,
      "gini": null,
      "fem_sec_enroll": 89.60752233538,
      "fem_years_schooling": null,
      "flfp": 61.35,
      "gii": null,
      "contraceptive": null,
      "child_mortality": 17.9,
      "adolescent_fertility": 34.856,
      "urbanisation": 58.573795837717,
      "social_cohesion": null
    }
  },
  {
    "iso3": "BDI",
    "iso_num": 108,
    "name": "Burundi",
    "region": "Sub-Saharan Africa",
    "tfr": 4.789,
    "tfr_year": 2024,
    "factors": {
      "gdp_pc": 1051.25931339275,
      "gini": 37.5,
      "fem_sec_enroll": 49.2576387332398,
      "fem_years_schooling": null,
      "flfp": 79.728,
      "gii": null,
      "contraceptive": 28.5,
      "child_mortality": 47.1,
      "adolescent_fertility": 52.49,
      "urbanisation": 24.8302838651025,
      "social_cohesion": null
    }
  },
  {
    "iso3": "BEL",
    "iso_num": 56,
    "name": "Belgium",
    "region": "Europe & Central Asia",
    "tfr": 1.44,
    "tfr_year": 2024,
    "factors": {
      "gdp_pc": 63347.7858809235,
      "gini": 26.8,
      "fem_sec_enroll": 152.577819824219,
      "fem_years_schooling": null,
      "flfp": 49.97,
      "gii": null,
      "contraceptive": 66.7,
      "child_mortality": 3.7,
      "adolescent_fertility": 3.504,
      "urbanisation": 87.6126557010527,
      "social_cohesion": null
    }
  },
  {
    "iso3": "BEN",
    "iso_num": 204,
    "name": "Benin",
    "region": "Sub-Saharan Africa",
    "tfr": 4.48,
    "tfr_year": 2024,
    "factors": {
      "gdp_pc": 3901.32588494392,
      "gini": 34.4,
      "fem_sec_enroll": 40.2818489074707,
      "fem_years_schooling": null,
      "flfp": 74.985,
      "gii": null,
      "contraceptive": 22.4,
      "child_mortality": 74.7,
      "adolescent_fertility": 76.407,
      "urbanisation": 52.5455354818423,
      "social_cohesion": null
    }
  },
  {
    "iso3": "BFA",
    "iso_num": 854,
    "name": "Burkina Faso",
    "region": "Sub-Saharan Africa",
    "tfr": 4.11,
    "tfr_year": 2024,
    "factors": {
      "gdp_pc": 2547.67232852209,
      "gini": 37.4,
      "fem_sec_enroll": 33.2389182465594,
      "fem_years_schooling": null,
      "flfp": 64.113,
      "gii": null,
      "contraceptive": 33.9627403568433,
      "child_mortality": 74.9,
      "adolescent_fertility": 85.533,
      "urbanisation": 28.3352514896662,
      "social_cohesion": null
    }
  },
  {
    "iso3": "BGD",
    "iso_num": 50,
    "name": "Bangladesh",
    "region": "South Asia",
    "tfr": 2.138,
    "tfr_year": 2024,
    "factors": {
      "gdp_pc": 8486.78495660517,
      "gini": 30.9,
      "fem_sec_enroll": 70.4720309842244,
      "fem_years_schooling": null,
      "flfp": 38.708,
      "gii": null,
      "contraceptive": 64.0,
      "child_mortality": 30.5,
      "adolescent_fertility": 70.813,
      "urbanisation": 32.6783196323307,
      "social_cohesion": null
    }
  },
  {
    "iso3": "BGR",
    "iso_num": 100,
    "name": "Bulgaria",
    "region": "Europe & Central Asia",
    "tfr": 1.72,
    "tfr_year": 2024,
    "factors": {
      "gdp_pc": 34221.5294617032,
      "gini": 39.5,
      "fem_sec_enroll": 93.8516082763672,
      "fem_years_schooling": null,
      "flfp": 50.487,
      "gii": null,
      "contraceptive": null,
      "child_mortality": 5.7,
      "adolescent_fertility": 38.035,
      "urbanisation": 73.9499356882481,
      "social_cohesion": null
    }
  },
  {
    "iso3": "BHR",
    "iso_num": 48,
    "name": "Bahrain",
    "region": "Middle East, North Africa, Afghanistan & Pakistan",
    "tfr": 1.805,
    "tfr_year": 2024,
    "factors": {